09:03:17.636638 eth0  In  IP 104.28.166.50.54220 > 23.145.36.136.56010: Flags [S], seq 1077273997, win 65535, options [mss 1332,sackOK,TS val 3396262661 ecr 0,nop,wscale 13], length 0
09:03:17.636699 eth0  Out IP 23.145.36.136.56010 > 104.28.166.50.54220: Flags [S.], seq 46738319, ack 1077273998, win 43440, options [mss 1460,sackOK,TS val 3491525137 ecr 3396262661,nop,wscale 9], length 0
09:03:17.684875 eth0  In  IP 104.28.166.50.54220 > 23.145.36.136.56010: Flags [.], ack 1, win 16, options [nop,nop,TS val 3396262709 ecr 3491525137], length 0
09:03:17.685033 eth0  In  IP 104.28.166.50.54220 > 23.145.36.136.56010: Flags [P.], seq 1:206, ack 1, win 16, options [nop,nop,TS val 3396262709 ecr 3491525137], length 205
09:03:17.685053 eth0  Out IP 23.145.36.136.56010 > 104.28.166.50.54220: Flags [.], ack 206, win 85, options [nop,nop,TS val 3491525185 ecr 3396262709], length 0
09:03:17.685277 eth0  Out IP 23.145.36.136.56010 > 104.28.166.50.54220: Flags [P.], seq 1:40, ack 206, win 85, options [nop,nop,TS val 3491525185 ecr 3396262709], length 39
09:03:17.733456 eth0  In  IP 104.28.166.50.54220 > 23.145.36.136.56010: Flags [.], ack 40, win 16, options [nop,nop,TS val 3396262758 ecr 3491525185], length 0
09:03:17.734390 eth0  In  IP 104.28.166.50.54220 > 23.145.36.136.56010: Flags [P.], seq 206:1658, ack 40, win 16, options [nop,nop,TS val 3396262759 ecr 3491525185], length 1452
09:03:17.734422 eth0  Out IP 23.145.36.136.56010 > 104.28.166.50.54220: Flags [.], ack 1658, win 86, options [nop,nop,TS val 3491525235 ecr 3396262759], length 0
09:03:17.834543 eth0  Out IP 23.145.36.136.56010 > 104.28.166.50.54220: Flags [P.], seq 40:2680, ack 1658, win 86, options [nop,nop,TS val 3491525335 ecr 3396262759], length 2640
09:03:17.834567 eth0  Out IP 23.145.36.136.56010 > 104.28.166.50.54220: Flags [P.], seq 2680:4136, ack 1658, win 86, options [nop,nop,TS val 3491525335 ecr 3396262759], length 1456
09:03:17.834914 eth0  Out IP 23.145.36.136.56010 > 104.28.166.50.54220: Flags [P.], seq 4136:4900, ack 1658, win 86, options [nop,nop,TS val 3491525335 ecr 3396262759], length 764
09:03:17.882788 eth0  In  IP 104.28.166.50.54220 > 23.145.36.136.56010: Flags [.], ack 4136, win 16, options [nop,nop,TS val 3396262907 ecr 3491525335], length 0
09:03:17.884048 eth0  In  IP 104.28.166.50.54220 > 23.145.36.136.56010: Flags [P.], seq 1658:1688, ack 4900, win 16, options [nop,nop,TS val 3396262908 ecr 3491525335], length 30
09:03:17.884343 eth0  Out IP 23.145.36.136.56010 > 104.28.166.50.54220: Flags [F.], seq 4900, ack 1688, win 86, options [nop,nop,TS val 3491525384 ecr 3396262908], length 0
09:03:17.885093 eth0  In  IP 104.28.166.50.54220 > 23.145.36.136.56010: Flags [R.], seq 1688, ack 4900, win 16, options [nop,nop,TS val 3396262909 ecr 3491525335], length 0
09:03:17.932620 eth0  In  IP 104.28.166.50.54220 > 23.145.36.136.56010: Flags [R], seq 1077275685, win 0, length 0
